{
  "$schema": "../../../types/connection/httpLoginSteps.schema.json",
  "version": 1,
  "id": "supermicro",
  "evidence": {
    "class": "B",
    "source": "https://github.com/Alfredooe/FakeSupermicroIPMILogin/blob/1403021a66779e44d767ae15c017c6260ab408a7/app/static/index.html",
    "reviewed": "2026-10-12"
  },
  "credentialOrigins": [],
  "loginSteps": [
    {
      "kind": "form",
      "selectors": {
        "username": "form[name=\"form1\"] input[name=\"name\"]",
        "password": "form[name=\"form1\"] input[name=\"pwd\"][type=\"password\"]"
      }
    },
    {
      "kind": "submit",
      "submission": "click",
      "selectors": {
        "control": "form[name=\"form1\"] input[type=\"submit\"]"
      }
    }
  ]
}
